{"$schema":"https://json-schema.org/draft/2020-12/schema","$id":"https://example.invalid/opc/task.schema.json","title":"OPC Task","type":"object","required":["schema_version","id","status","owner","primary_worker","next_action","updated_at","artifacts"],"properties":{"schema_version":{"const":1},"id":{"type":"string","minLength":1},"title":{"type":"string"},"status":{"enum":["active","waiting","monitoring","parked","archived"]},"owner":{"type":"string","minLength":1},"primary_worker":{"type":["string","null"]},"claimed_by":{"type":["string","null"]},"claimed_at":{"type":["string","null"]},"next_action":{"type":"string","minLength":1},"updated_at":{"type":"string","minLength":1},"artifacts":{"type":"array","items":{"type":"string"}},"decision_gate":{"type":["object","null"]},"hard_gates_pending":{"type":"array","items":{"type":"string"}},"downstream_requires_ack":{"type":"boolean","default":false}},"additionalProperties":true}