{"schema_version":1,"id":"product-release","title":"Implement and verify a small product change","status":"active","owner":"product","primary_worker":"worker-b","claimed_by":"worker-b","claimed_at":"2026-01-01T09:45:00Z","next_action":"Resume the same implementation batch from canonical task state; do not repeat completed work.","updated_at":"2026-01-01T09:45:00Z","artifacts":[],"decision_gate":null,"hard_gates_pending":[],"downstream_requires_ack":false}