{"schema_version":1,"id":"research-to-content","title":"Turn verified research into a content draft","status":"active","owner":"research","primary_worker":"worker-a","claimed_by":"worker-a","claimed_at":"2026-01-01T09:00:00Z","next_action":"Produce verified research artifact and hand it to Content Owner.","updated_at":"2026-01-01T09:00:00Z","artifacts":[],"decision_gate":null,"hard_gates_pending":[],"downstream_requires_ack":true}