{"schema_version":1,"id":"product-release","title":"Implement and verify a small product change","status":"active","owner":"product","primary_worker":"worker-a","claimed_by":"worker-a","claimed_at":"2026-01-01T09:00:00Z","next_action":"Implement the change and produce validation evidence.","updated_at":"2026-01-01T09:00:00Z","artifacts":[],"decision_gate":null,"hard_gates_pending":[],"downstream_requires_ack":false}